Ratings,Comment,Reviews
4,Liked the experience,Somehow I liked it. Great user experience!
5,Excellent condition and performance," It came in excellent condition, and it works well with MetroPCS."
5,Excelente producto," An excellent product, a great investment."
5,Worth the purchase," It was a great investment, worth the purchase."
5,Delivered on time,I received the product on time.
5,Satisfied with the phone,Great phone with satisfactory performance.
5," Great phone, great value "," I'm very pleased with this item. Great phone, great value for money."
4,Phone works well," The phone works well with MetroPCS, no complaints."
5,Very satisfied,I am much more satisfied with this phone than with my previous one.
5,Impressed with the product,Impressed with the phone's condition and performance.
5,Impressive battery life," Outstanding battery life, a full day of use without worries."
4,Reliable and efficient,Loaded with practical features that enhance usability.
5,Camera captures memories beautifully,The camera consistently captures beautiful memories.
4,Battery you can count on," The battery lasts throughout the day, a reliable power source."
5,Vivid display visuals," The display is sharp, offering vivid visuals."
5,Great value for money," Exceptional value for money, a smart investment."
4,A practical device,Loaded with practical features that simplify daily tasks.
5,Remarkable battery performance," The battery life is remarkable, ensuring prolonged connectivity."
4,Efficient and user-friendly,Efficient and user-friendly elements make it a breeze to use.
5,Captures beautiful moments,The camera consistently delivers outstanding quality.
4,A reliable power source," The device offers long-lasting power, ensuring connectivity all day."
5,Worth the purchase," A valuable purchase, great value for money."
4,Battery endures the day," The battery endures the day, ensuring uninterrupted use for hours."
5,Streamlined user experience,A streamlined user experience with rich features.
4,Reliable and consistent battery,Reliable and consistent battery performance.
5,Exceptional value for money," Exceptional value for money, a top-tier investment."
4,Efficient and practical,Efficient and practical features simplify daily tasks.
4,Remarkable camera quality,The camera consistently delivers remarkable quality shots.
5,Visual delight,Visual delight with a display that's a treat to the eyes.
4,A wise buy,The Samsung Galaxy J5 offers practical features that simplify daily tasks.
5,No need for constant charging," The battery performance is outstanding, reducing the need for constant charging."
4,Loaded with intuitiveness,Loaded with intuitively practical features that simplify everyday tasks.
5,Outstanding camera capabilities,Outstanding camera capabilities consistently capture stunning memories.
4,Brilliant investment,Long-lasting and reliable battery performance.
5,Uninterrupted use,Reliable and enduring battery ensures uninterrupted use.
4,Exceptional battery performance," Exceptional battery performance, reducing the need for frequent charging."
5,Exceptional capabilities,The Samsung Galaxy J5 offers practical features that simplify daily tasks.
4,Outstanding quality,The camera consistently delivers outstanding quality shots.
5,Sharp and vibrant," The display is a visual marvel, offering brilliance and vibrant visuals."
4,Outstanding performance," The phone's performance is outstanding, it keeps up effortlessly."
5,Battery that lasts," A battery that lasts throughout the day, no worries about recharging."
5,Feature-packed delight,Loaded with features that make daily tasks a delight.
4,Pristine display clarity," The display clarity is pristine, showcasing vivid visuals."
5,Stellar battery performance," Stellar battery performance, lasting all day without any issues."
4,Feature-rich and practical," Feature-rich and practical device, making daily tasks a breeze."
5,Exceptional camera capabilities," Exceptional camera capabilities, capturing memories with precision."
4,Reliable and enduring battery," Reliable and enduring battery, ensuring no sudden power loss."
5,Vivid display brilliance," Vivid display brilliance, offering vibrant colors and sharp clarity."
5,Superb value for money," Superb value for money, a wise investment for the price."
4,User-friendly and efficient," User-friendly and efficient device, simplifying everyday life."
5,Camera that captures beauty,The camera consistently captures the beauty of life flawlessly.
4,A practical purchase," A practical purchase, loaded with features for convenience."
5,Visual delight with clarity," Visual delight with clarity, offering vivid and stunning visuals."
2,Disappointing performance,I'm disappointed with the phone's overall performance. It lags and crashes often.
1,Terrible battery life," The battery life is terrible. It barely lasts a few hours, making it frustrating to use."
2,Lackluster features," The phone lacks essential features, and it feels outdated in terms of functionality."
1,Awful camera quality," The camera quality is awful, and it produces blurry and grainy photos."
2,Unreliable battery," The battery is unreliable, with sudden power drains that disrupt my usage."
1,Dull display,The display is dull and lacks vibrant colors. It's not visually appealing.
2,Not worth the money,This phone is not worth the money. It's overpriced for the features it offers.
1,Frustrating experience,Using this phone has been a frustrating experience. It's slow and unresponsive.
2,Limited value for money,There's limited value for money with this device. It doesn't meet expectations.
1,Avoid this phone,My advice is to avoid this phone. It's not worth the trouble it brings.
5,Outstanding battery performance," The phone's battery performance is outstanding, lasting all day without any issues. The battery is reliable and enduring, with no sudden power losses."
4,Feature-rich and practical," This device is feature-rich and practical, making daily tasks a breeze. The phone is user-friendly and efficient."
5,Exceptional camera capabilities,The camera consistently delivers exceptional quality shots. It captures life's beauty with precision and clarity.
4,Reliable and enduring battery," The battery is reliable and enduring, ensuring no unexpected power losses. Battery performance is consistent and dependable."
5,Vivid display brilliance," The display's brilliance is vivid and clear, offering vibrant colors and sharp clarity. Visual delight at its best."
5,Superb value for money," The phone offers superb value for money, a wise investment for the price. It's a practical purchase, loaded with features for convenience."
4,User-friendly and efficient," The device is user-friendly and efficient, simplifying everyday life. It's efficient and practical."
5,Camera that captures beauty,The camera consistently captures the beauty of life flawlessly. It's exceptional camera capabilities that impress.
4,A practical purchase," It's a practical purchase, loaded with features for convenience. The phone is user-friendly and efficient."
5,Visual delight with clarity," The display is a visual delight with clarity, offering vivid and stunning visuals. It's outstanding display quality."
4,Streamlined user experience,The phone offers a streamlined user experience with rich features. It's loaded with practicality.
5,Battery that powers through," The battery powers through the day, ensuring uninterrupted use. It's long-lasting power, reducing the need for constant charging."
4,Exceptional value for money," The phone provides exceptional value for money, a top-tier investment. It's unparalleled value for money."
5,Efficient and practical," The phone is efficient and practical, loaded with intuitively practical features. It simplifies everyday tasks."
4,Consistent camera excellence," The camera consistently delivers consistent excellence, capturing stunning memories. It's remarkable camera quality."
5,Reliable and resilient battery," The battery is reliable and resilient, ensuring no sudden power loss. Battery performance you can count on."
4,Display brilliance at its best," The display offers brilliance at its best, with vivid and clear visuals. It's a visual delight."
5,Outstanding display quality," The phone boasts outstanding display quality, offering vivid and stunning visuals. It's a visual delight with clarity."
4,Long-lasting and reliable,The battery provides long-lasting and reliable performance. It endures the day without issues.
5,Exceptional bang for the buck," It's exceptional bang for the buck, offering great value for money. The phone is a wise buy."
4,Loaded with pragmatism," The device is loaded with pragmatism, offering efficient and practical features. It's user-friendly and efficient."
5,Camera captures life's beauty,The camera consistently captures life's beauty with precision and clarity. It's a camera that impresses.
4,Smart investment," The phone is a smart investment, with long-lasting and reliable battery performance. It's a brilliant investment."
5,Vivid and clear display," The display is vivid and clear, offering vibrant colors and sharp clarity. It's visual delight at its best."
4,Efficient and convenient," The device is efficient and convenient, simplifying everyday life. It's user-friendly and efficient."
5,Battery performance you can count on,The battery performance is reliable and consistent. It's battery performance you can count on.
4,Loaded with practicality," The phone is loaded with practicality, offering streamlined user experience with rich features. It's efficient and practical."
5,User-friendly and efficient," The device is user-friendly and efficient, simplifying daily tasks. It's a practical and efficient choice."
4,Battery that lasts and lasts," The battery is reliable and long-lasting, providing uninterrupted power. No need for constant charging."
5,Loaded with practicality," The phone is loaded with practicality, making daily tasks a breeze. It's a feature-rich and practical device."
4,Camera captures moments beautifully,The camera consistently captures beautiful moments with precision. Exceptional camera quality.
5,Sharp and vibrant display," The display is sharp and vibrant, offering stunning visuals. It's a visual delight with clarity."
4,Efficient and practical features," The device is loaded with efficient and practical features, streamlining daily tasks. User-friendly and practical."
5,Outstanding battery life," The phone boasts outstanding battery life, lasting all day without worries. Battery that powers through."
4,Streamlined user experience,The phone offers a streamlined user experience with rich features. Feature-rich and practical.
5,Exceptional camera capabilities,The camera consistently delivers exceptional quality shots. It captures life's beauty with clarity.
4,Reliable and consistent battery," The battery is reliable and consistent, ensuring no sudden power losses. It's long-lasting and dependable."
5,Vivid and clear visuals,The display offers vivid and clear visuals with vibrant colors. Outstanding display quality.
4,Efficient and user-friendly," The device is efficient and user-friendly, simplifying everyday life. It's user-friendly and efficient."
5,Outstanding value for money," The phone provides outstanding value for money, making it a top-tier investment. Unparalleled value for money."
4,Battery endures the day," The battery endures the day, ensuring uninterrupted use for hours. Battery performance you can count on."
5,Visual delight with clarity," The display is a visual delight with clarity, showcasing vivid and stunning visuals. Vivid and clear display."
4,Loaded with features,The phone is loaded with features that enhance usability. Feature-rich and practical.
5,Reliable and resilient battery," The battery is reliable and resilient, ensuring no unexpected power loss. Battery that lasts and lasts."
4,Display brilliance at its best," The display offers brilliance at its best, with vivid and clear visuals. A visual treat."
5,Consistent camera excellence,The camera consistently delivers excellent shots with remarkable quality. Captures life's beauty.
4,Efficient and practical device," The device is efficient and practical, loaded with features for convenience. Loaded with pragmatism."
2,Battery drains quickly," The battery drains too quickly, not suitable for extended use."
1,Features are disappointing," Disappointed with the lackluster features, not up to expectations."
2,Camera quality is poor," The camera quality is subpar, unable to capture good photos."
1,Terrible battery life," The battery life is terrible, constantly needs recharging."
2,Display lacks clarity," The display lacks clarity, and the colors are dull."
1,Waste of money,This purchase feels like a complete waste of money.
2,Inefficient features,The features are inefficient and not user-friendly.
1,Frequent freezes," The phone freezes frequently, making it frustrating to use."
2,Unreliable battery," The battery is unreliable, power loss occurs suddenly."
1,Regret buying," Regret buying this device, it's been nothing but trouble."
2,Mediocre camera,The camera's performance is mediocre at best.
1,Horrible battery backup," Horrible battery backup, needs charging multiple times a day."
2,Disappointing features," The features are disappointing, not worth the price."
1,Frustrating experience,Using this phone has been a frustrating experience.
2,Display is lackluster," The display is lackluster, not vibrant or sharp."
1,Money down the drain,Feel like I've thrown my money down the drain with this purchase.
2,Features don't work well," Many features don't work well, leading to frustration."
1,Constant crashes,Constant crashes and issues with this device.
2,Poor camera quality," The camera quality is poor, resulting in blurry photos."
1,Battery drains rapidly," The battery drains rapidly, even during light use."
2,Not user-friendly,The device is not user-friendly and has a steep learning curve.
1,Terrible purchase," This has been a terrible purchase, nothing but problems."
2,Dull display,The display is dull and lacks the expected clarity.
1,Never again," Will never buy this product again, extremely disappointed."
2,Ineffective features,The features are ineffective and poorly executed.
1,Waste of time and money,Using this phone has been a waste of both time and money.
2,Camera disappoints,The camera disappoints with its low-quality shots.
1,Regretful choice," Regret choosing this device, it's been a nightmare."
2,Inefficient battery,The battery is inefficient and unreliable.
1,Absolute disaster," An absolute disaster of a purchase, nothing but trouble."
2,Mediocre performance,The device's performance is mediocre and underwhelming.
3,Decent battery performance," The battery performance is decent, lasting through most of the day."
3,Good set of features," The phone offers a good set of features, but some could be improved."
3,Camera is average," The camera is average, not exceptional but gets the job done."
3,Battery life is okay," The battery life is okay, requires charging during the day."
3,Display quality is decent," The display quality is decent, but not the best I've seen."
3,Value for money is fair," It provides fair value for money, with room for improvement."
3,Features are functional," The features are functional, but could be more user-friendly."
3,Camera performance is acceptable," The camera performance is acceptable, not remarkable."
3,Battery performs adequately," The battery performs adequately, although it could be better."
3,Display clarity is passable," Display clarity is passable, but there's room for enhancement."
3,Offers decent features," The device offers decent features, but some refinement is needed."
3,Camera quality is passable," The camera quality is passable, could be improved."
3,Battery life is decent," The battery life is decent, lasts through moderate use."
3,Display is satisfactory," The display is satisfactory, providing clear visuals."
3,Provides fair value," The device provides fair value for money, with some drawbacks."
3,Features meet expectations," The features meet expectations, but there's room for improvement."
3,Camera functionality is fine," The camera functionality is fine, it does the job."
3,Battery performs reasonably," The battery performs reasonably well, lasting through the day."
3,Display offers clarity," The display offers clarity, but it's not the best I've seen."
3,Reasonable value for money," It offers reasonable value for money, but there's better out there."
3,Functional features," The features are functional, but not as intuitive as I'd like."
3,Camera does the job," The camera does the job, though it's not exceptional."
3,Battery life is acceptable,The battery life is acceptable for everyday use.
3,Display quality is fair," The display quality is fair, offering decent visuals."
3,Provides okay value," The device provides okay value for money, but there are limitations."
3,Features are passable," The features are passable, but not remarkable."
3,Camera performance is average," The camera performance is average, not exceptional."
3,Battery performs reasonably well," The battery performs reasonably well, considering the usage."
3,Display clarity is fine," Display clarity is fine, offering acceptable visuals."
3,Offers decent value," It offers decent value for money, but there are room for enhancements."
3,Features are functional enough," The features are functional enough, but could be more user-friendly."
5,Exceptional battery life,The battery life on this phone is exceptional; it easily lasts all day.
4,Feature-packed marvel," A feature-packed marvel, this phone enhances productivity and entertainment."
4,Camera captures stunning moments,The camera captures stunning moments with precision and clarity.
5,Reliable battery performance," The battery performance is reliable, lasting through heavy use."
5,Stunning display visuals," The display visuals are stunning, offering vibrant colors and sharpness."
4,Great value for money," It provides great value for money, offering top-tier features."
5,User-friendly and efficient," The device is user-friendly and efficient, making tasks a breeze."
4,Exceptional camera quality,The camera consistently delivers exceptional quality photos.
4,Prolonged battery endurance," The battery endures for extended periods, ensuring uninterrupted use."
5,Vivid and clear display," The display is vivid and clear, delivering a visual treat."
4,Smart investment choice," Choosing this phone was a smart investment, loaded with practical features."
5,Camera excels in every shot," The camera excels in every shot, capturing memories flawlessly."
5,Dependable battery life," The battery life is dependable, requiring fewer recharges."
4,Efficient and practical,Efficient and practical features simplify daily tasks with ease.
4,Outstanding camera capabilities,Outstanding camera capabilities consistently capture stunning memories.
5,Exceptional value for money," The value for money is exceptional, a wise investment."
5,User-friendly experience," The device offers a user-friendly experience, enhancing convenience."
4,Remarkable battery performance," The battery performance is remarkable, reducing the need for frequent charging."
5,Superior display quality," The display quality is superior, providing immersive visuals."
4,Packed with practicality,Packed with practical features that streamline daily tasks.
5,Battery life that impresses," The battery life is impressive, lasting throughout the day."
5,Top-tier performance," This phone's performance is top-tier, handling everything effortlessly."
4,Captures beauty effortlessly,The camera captures the beauty of life effortlessly.
5,Reliable power source," The battery is a reliable power source, ensuring continuous connectivity."
4,Efficient and intuitive," The device is efficient and intuitive, simplifying everyday life."
4,Battery life to count on," The battery life is reliable, offering hours of uninterrupted use."
5,Exceptional features," The device offers exceptional features, making it a practical choice."
4,Camera captures moments,The camera captures moments with precision and clarity.
5,Vivid and vibrant display," The display is vivid and vibrant, a delight to the eyes."
4,Smart investment decision," Investing in this device was a smart decision, offering practicality."
5,Battery that endures," The battery endures without fail, ensuring constant connectivity."
5,Unbelievable battery performance," The battery performance on this phone is absolutely unbelievable, lasting for days."
5,Feature-rich wonder," This phone is a feature-rich wonder, transforming productivity and entertainment."
4,Camera captures memories beautifully,The camera consistently captures beautiful memories with precision.
5,Dependable battery life," The battery life is incredibly dependable, lasting through even heavy usage."
4,Vivid display visuals,The display offers vivid visuals with vibrant colors and sharp clarity.
5,Exceptional value for money," It provides exceptional value for money, making it a wise investment."
4,User-friendly and efficient," This device is incredibly user-friendly and efficient, simplifying daily tasks."
4,Outstanding camera quality,The camera consistently delivers outstanding quality photos.
5,Extended battery endurance," The battery endures for extended periods, reducing the need for frequent charging."
5,Clarity in every display," The display clarity is remarkable, delivering a visual treat with every use."
4,Wise investment choice," Choosing this phone was a wise investment, loaded with practical and innovative features."
5,Camera excels in every shot," The camera excels in every shot, capturing memories with brilliance."
5,Reliable battery life," The battery life is incredibly reliable, requiring minimal recharges."
4,Streamlined and practical," The device is streamlined and practical, offering features that simplify daily tasks."
5,Outstanding camera capabilities," The camera capabilities are outstanding, consistently capturing stunning memories."
4,Superb value for money," It provides superb value for money, offering top-tier features for a reasonable price."
4,User-friendly and efficient," This device is user-friendly and efficient, making daily tasks a breeze."
4,Remarkable battery performance," The battery performance is remarkable, ensuring uninterrupted use."
5,Superior display quality," The display quality is superior, providing an immersive and enjoyable visual experience."
5,Packed with practicality,This device is packed with practical features that streamline daily tasks.
5,Battery life that amazes," The battery life is nothing short of amazing, lasting throughout the day with ease."
4,Top-tier performance," This phone's performance is top-tier, handling everything effortlessly."
5,Captures beauty flawlessly," The camera captures the beauty of life flawlessly, ensuring every shot is perfect."
4,Reliable power source," The battery is a reliable power source, guaranteeing constant connectivity."
4,Efficient and intuitive," This device is efficient and intuitive, simplifying everyday life."
4,Battery life to rely on," The battery life is reliable, offering hours of uninterrupted use."
5,Exceptional features," The device offers exceptional features, enhancing its practicality."
5,Camera captures moments perfectly," The camera captures moments perfectly, with precision and clarity."
5,Visual delight on the display," The display is a visual delight, offering vibrancy and sharpness."
5,Smart investment decision," Investing in this device was a smart decision, providing practicality and value."
4,Battery that endures," The battery endures without fail, ensuring constant connectivity."
4,Remarkable battery performance," The battery performance is remarkable, ensuring uninterrupted use."
1,Frustrating features,The features on this device are frustrating and often don't work as expected.
5,Exceptional camera quality,The camera consistently delivers exceptional quality photos.
2,Poor battery life," Unfortunately, the battery life is poor, requiring frequent recharges."
4,User-friendly and efficient," This device is user-friendly and efficient, making daily tasks a breeze."
1,Disappointing camera performance," The camera performance is disappointing, not up to par."
5,Outstanding display visuals," The display visuals are outstanding, delivering clear and vibrant images."
2,Terrible value for money," It offers terrible value for money, given the numerous issues."
5,Extended battery endurance," The battery endures for extended periods, reducing the need for frequent charging."
1,Frustrating user experience," The overall user experience is frustrating, with frequent glitches."
4,Excellent camera capabilities," The camera capabilities are excellent, capturing stunning memories."
2,Inadequate battery life,The battery life is inadequate and doesn't meet daily needs.
5,Superior display quality," The display quality is superior, providing an immersive visual experience."
1,Regrettable purchase,I regret this purchase due to poor performance and high cost.
4,Practical and efficient," This device is practical and efficient, simplifying daily tasks."
1,Worthless camera quality," The camera quality is practically worthless, producing blurry photos."
5,Fantastic value for money," It provides fantastic value for money, with a wealth of features."
2,Battery woes," Unfortunately, the battery life is a major issue, constantly requiring charging."
4,User-friendly experience," The device offers a user-friendly experience, enhancing convenience."
1,Disastrous camera performance," The camera performance is disastrous, with constant errors."
